{
  "schema_version": "1.1",
  "identity": {
    "board_pn": "04B-015",
    "board_rev": "A1-01",
    "board_type": "schematic"
  },
  "metadata": {
    "project_name": "PUSH-PULL AMPLIFIER",
    "revision": "A1-01",
    "source_tool": "EAGLE 6.3"
  },
  "components": [
    {
      "refdes": "C1",
      "value": "100n",
      "footprint": "C050-024X044",
      "pins": [
        {
          "pin_number": "1",
          "net": "INPUT"
        },
        {
          "pin_number": "2",
          "net": "INPUT_AC_COUPLED"
        }
      ]
    },
    {
      "refdes": "C2",
      "value": "100n",
      "footprint": "C050-024X044",
      "pins": [
        {
          "pin_number": "2",
          "net": "GND"
        },
        {
          "pin_number": "1",
          "net": "V+"
        }
      ]
    },
    {
      "refdes": "C3",
      "value": "100n",
      "footprint": "C050-024X044",
      "pins": [
        {
          "pin_number": "2",
          "net": "GND"
        },
        {
          "pin_number": "1",
          "net": "V+"
        }
      ]
    },
    {
      "refdes": "C4",
      "value": "100n",
      "footprint": "C050-024X044",
      "pins": [
        {
          "pin_number": "1",
          "net": "EMITTERS"
        },
        {
          "pin_number": "2",
          "net": "OUTPUT"
        }
      ]
    },
    {
      "refdes": "D1",
      "value": "1N4148",
      "footprint": "DO07",
      "pins": [
        {
          "pin_number": "A",
          "net": "BASE_Q1"
        },
        {
          "pin_number": "C",
          "net": "INPUT_AC_COUPLED"
        }
      ]
    },
    {
      "refdes": "D2",
      "value": "1N4148",
      "footprint": "DO07",
      "pins": [
        {
          "pin_number": "C",
          "net": "BASE_Q2"
        },
        {
          "pin_number": "A",
          "net": "INPUT_AC_COUPLED"
        }
      ]
    },
    {
      "refdes": "P1",
      "value": "",
      "footprint": "PINS_1X5",
      "pins": [
        {
          "pin_number": "1",
          "net": "GND"
        },
        {
          "pin_number": "4",
          "net": "INPUT"
        },
        {
          "pin_number": "5",
          "net": "OUTPUT"
        },
        {
          "pin_number": "2",
          "net": "V+"
        }
      ]
    },
    {
      "refdes": "Q1",
      "value": "NPN",
      "footprint": "TO92-EBC-OVAL",
      "pins": [
        {
          "pin_number": "B",
          "net": "BASE_Q1"
        },
        {
          "pin_number": "E",
          "net": "EMITTERS"
        },
        {
          "pin_number": "C",
          "net": "V+"
        }
      ]
    },
    {
      "refdes": "Q2",
      "value": "PNP",
      "footprint": "TO92-EBC-OVAL",
      "pins": [
        {
          "pin_number": "B",
          "net": "BASE_Q2"
        },
        {
          "pin_number": "E",
          "net": "EMITTERS"
        },
        {
          "pin_number": "C",
          "net": "GND"
        }
      ]
    },
    {
      "refdes": "R1",
      "value": "10k",
      "footprint": "0207/10",
      "pins": [
        {
          "pin_number": "2",
          "net": "BASE_Q2"
        },
        {
          "pin_number": "1",
          "net": "GND"
        }
      ]
    },
    {
      "refdes": "R2",
      "value": "10k",
      "footprint": "0207/10",
      "pins": [
        {
          "pin_number": "1",
          "net": "BASE_Q1"
        },
        {
          "pin_number": "2",
          "net": "V+"
        }
      ]
    },
    {
      "refdes": "R3",
      "value": "10k",
      "footprint": "0207/10",
      "pins": [
        {
          "pin_number": "1",
          "net": "GND"
        },
        {
          "pin_number": "2",
          "net": "OUTPUT"
        }
      ]
    },
    {
      "refdes": "TP1",
      "value": "INPUT",
      "footprint": "PINS_1_TESTPOINT_KE5000_NOTEXT",
      "pins": [
        {
          "pin_number": "1",
          "net": "INPUT"
        }
      ]
    },
    {
      "refdes": "TP2",
      "value": "INPUT_AC_COUPLED",
      "footprint": "PINS_1_TESTPOINT_KE5000_NOTEXT",
      "pins": [
        {
          "pin_number": "1",
          "net": "INPUT_AC_COUPLED"
        }
      ]
    },
    {
      "refdes": "TP3",
      "value": "OUTPUT_DC_COUPLED",
      "footprint": "PINS_1_TESTPOINT_KE5000_NOTEXT",
      "pins": [
        {
          "pin_number": "1",
          "net": "EMITTERS"
        }
      ]
    },
    {
      "refdes": "TP4",
      "value": "V+",
      "footprint": "PINS_1_TESTPOINT_KE5000_NOTEXT",
      "pins": [
        {
          "pin_number": "1",
          "net": "V+"
        }
      ]
    },
    {
      "refdes": "TP5",
      "value": "GND",
      "footprint": "PINS_1_TESTPOINT_KE5000_NOTEXT",
      "pins": [
        {
          "pin_number": "1",
          "net": "GND"
        }
      ]
    },
    {
      "refdes": "TP6",
      "value": "OUTPUT",
      "footprint": "PINS_1_TESTPOINT_KE5000_NOTEXT",
      "pins": [
        {
          "pin_number": "1",
          "net": "OUTPUT"
        }
      ]
    }
  ],
  "nets": [
    {
      "name": "BASE_Q1",
      "connections": [
        { "refdes": "Q1", "pin": "B" },
        { "refdes": "D1", "pin": "A" },
        { "refdes": "R2", "pin": "1" }
      ]
    },
    {
      "name": "BASE_Q2",
      "connections": [
        { "refdes": "Q2", "pin": "B" },
        { "refdes": "R1", "pin": "2" },
        { "refdes": "D2", "pin": "C" }
      ]
    },
    {
      "name": "EMITTERS",
      "connections": [
        { "refdes": "TP3", "pin": "1" },
        { "refdes": "C4", "pin": "1" },
        { "refdes": "Q1", "pin": "E" },
        { "refdes": "Q2", "pin": "E" }
      ]
    },
    {
      "name": "GND",
      "connections": [
        { "refdes": "C2", "pin": "2" },
        { "refdes": "C3", "pin": "2" },
        { "refdes": "R1", "pin": "1" },
        { "refdes": "TP5", "pin": "1" },
        { "refdes": "P1", "pin": "1" },
        { "refdes": "R3", "pin": "1" },
        { "refdes": "Q2", "pin": "C" }
      ]
    },
    {
      "name": "INPUT",
      "connections": [
        { "refdes": "TP1", "pin": "1" },
        { "refdes": "C1", "pin": "1" },
        { "refdes": "P1", "pin": "4" }
      ]
    },
    {
      "name": "INPUT_AC_COUPLED",
      "connections": [
        { "refdes": "C1", "pin": "2" },
        { "refdes": "TP2", "pin": "1" },
        { "refdes": "D1", "pin": "C" },
        { "refdes": "D2", "pin": "A" }
      ]
    },
    {
      "name": "OUTPUT",
      "connections": [
        { "refdes": "P1", "pin": "5" },
        { "refdes": "C4", "pin": "2" },
        { "refdes": "R3", "pin": "2" },
        { "refdes": "TP6", "pin": "1" }
      ]
    },
    {
      "name": "V+",
      "connections": [
        { "refdes": "TP4", "pin": "1" },
        { "refdes": "R2", "pin": "2" },
        { "refdes": "P1", "pin": "2" },
        { "refdes": "C2", "pin": "1" },
        { "refdes": "C3", "pin": "1" },
        { "refdes": "Q1", "pin": "C" }
      ]
    }
  ],
  "test_integration": {
    "coverage_status": "partial",
    "auto_generated": true,
    "test_points": [
      {
        "refdes": "TP1",
        "net": "INPUT",
        "measurement_type": "voltage"
      },
      {
        "refdes": "TP2",
        "net": "INPUT_AC_COUPLED",
        "measurement_type": "voltage"
      },
      {
        "refdes": "TP3",
        "net": "EMITTERS",
        "measurement_type": "voltage"
      },
      {
        "refdes": "TP4",
        "net": "V+",
        "measurement_type": "voltage"
      },
      {
        "refdes": "TP5",
        "net": "GND",
        "measurement_type": "voltage"
      },
      {
        "refdes": "TP6",
        "net": "OUTPUT",
        "measurement_type": "voltage"
      }
    ]
  },
  "analysis": {
    "component_count": 18,
    "net_count": 8
  }
}
