{
  "schema_version": "1.1",
  "identity": {
    "board_pn": "04C-55",
    "board_rev": "A1-01",
    "board_type": "schematic"
  },
  "metadata": {
    "project_name": "DUAL AMPLIFIER MATRIX",
    "revision": "A1-01",
    "source_tool": "EAGLE 6.3"
  },
  "components": [
    {
      "refdes": "J1",
      "value": "",
      "footprint": "PINS_6",
      "pins": [
        {
          "pin_number": "5",
          "net": "AC_SIGNAL_CHANNEL_A_OUTPUT_FROM_J1_TO_J2_INPUT"
        },
        {
          "pin_number": "6",
          "net": "AC_SIGNAL_CHANNEL_B_OUTPUT_FROM_J1_TO_J3_INPUT"
        },
        {
          "pin_number": "4",
          "net": "AC_SIGNAL_INPUT_TO_J1"
        },
        {
          "pin_number": "1",
          "net": "GND"
        },
        {
          "pin_number": "2",
          "net": "V+"
        },
        {
          "pin_number": "3",
          "net": "V-"
        }
      ]
    },
    {
      "refdes": "J2",
      "value": "",
      "footprint": "PINS_6",
      "pins": [
        {
          "pin_number": "4",
          "net": "AC_SIGNAL_CHANNEL_A_OUTPUT_FROM_J1_TO_J2_INPUT"
        },
        {
          "pin_number": "5",
          "net": "AC_SIGNAL_CHANNEL_A_OUTPUT_FROM_J2"
        },
        {
          "pin_number": "6",
          "net": "AC_SIGNAL_CHANNEL_B_OUTPUT_FROM_J2"
        },
        {
          "pin_number": "1",
          "net": "GND"
        },
        {
          "pin_number": "2",
          "net": "V+"
        },
        {
          "pin_number": "3",
          "net": "V-"
        }
      ]
    },
    {
      "refdes": "J3",
      "value": "",
      "footprint": "PINS_6",
      "pins": [
        {
          "pin_number": "5",
          "net": "AC_SIGNAL_CHANNEL_A_OUTPUT_FROM_J3"
        },
        {
          "pin_number": "4",
          "net": "AC_SIGNAL_CHANNEL_B_OUTPUT_FROM_J1_TO_J3_INPUT"
        },
        {
          "pin_number": "6",
          "net": "AC_SIGNAL_CHANNEL_B_OUTPUT_FROM_J3"
        },
        {
          "pin_number": "1",
          "net": "GND"
        },
        {
          "pin_number": "2",
          "net": "V+"
        },
        {
          "pin_number": "3",
          "net": "V-"
        }
      ]
    },
    {
      "refdes": "P1",
      "value": "",
      "footprint": "PINS_1X8",
      "pins": [
        {
          "pin_number": "5",
          "net": "AC_SIGNAL_CHANNEL_A_OUTPUT_FROM_J2"
        },
        {
          "pin_number": "7",
          "net": "AC_SIGNAL_CHANNEL_A_OUTPUT_FROM_J3"
        },
        {
          "pin_number": "6",
          "net": "AC_SIGNAL_CHANNEL_B_OUTPUT_FROM_J2"
        },
        {
          "pin_number": "8",
          "net": "AC_SIGNAL_CHANNEL_B_OUTPUT_FROM_J3"
        },
        {
          "pin_number": "4",
          "net": "AC_SIGNAL_INPUT_TO_J1"
        },
        {
          "pin_number": "1",
          "net": "GND"
        },
        {
          "pin_number": "2",
          "net": "V+"
        },
        {
          "pin_number": "3",
          "net": "V-"
        }
      ]
    }
  ],
  "nets": [
    {
      "name": "AC_SIGNAL_CHANNEL_A_OUTPUT_FROM_J1_TO_J2_INPUT",
      "connections": [
        { "refdes": "J1", "pin": "5" },
        { "refdes": "J2", "pin": "4" }
      ]
    },
    {
      "name": "AC_SIGNAL_CHANNEL_A_OUTPUT_FROM_J2",
      "connections": [
        { "refdes": "P1", "pin": "5" },
        { "refdes": "J2", "pin": "5" }
      ]
    },
    {
      "name": "AC_SIGNAL_CHANNEL_A_OUTPUT_FROM_J3",
      "connections": [
        { "refdes": "P1", "pin": "7" },
        { "refdes": "J3", "pin": "5" }
      ]
    },
    {
      "name": "AC_SIGNAL_CHANNEL_B_OUTPUT_FROM_J1_TO_J3_INPUT",
      "connections": [
        { "refdes": "J1", "pin": "6" },
        { "refdes": "J3", "pin": "4" }
      ]
    },
    {
      "name": "AC_SIGNAL_CHANNEL_B_OUTPUT_FROM_J2",
      "connections": [
        { "refdes": "P1", "pin": "6" },
        { "refdes": "J2", "pin": "6" }
      ]
    },
    {
      "name": "AC_SIGNAL_CHANNEL_B_OUTPUT_FROM_J3",
      "connections": [
        { "refdes": "P1", "pin": "8" },
        { "refdes": "J3", "pin": "6" }
      ]
    },
    {
      "name": "AC_SIGNAL_INPUT_TO_J1",
      "connections": [
        { "refdes": "P1", "pin": "4" },
        { "refdes": "J1", "pin": "4" }
      ]
    },
    {
      "name": "GND",
      "connections": [
        { "refdes": "P1", "pin": "1" },
        { "refdes": "J1", "pin": "1" },
        { "refdes": "J2", "pin": "1" },
        { "refdes": "J3", "pin": "1" }
      ]
    },
    {
      "name": "V+",
      "connections": [
        { "refdes": "J1", "pin": "2" },
        { "refdes": "J2", "pin": "2" },
        { "refdes": "J3", "pin": "2" },
        { "refdes": "P1", "pin": "2" }
      ]
    },
    {
      "name": "V-",
      "connections": [
        { "refdes": "P1", "pin": "3" },
        { "refdes": "J1", "pin": "3" },
        { "refdes": "J2", "pin": "3" },
        { "refdes": "J3", "pin": "3" }
      ]
    }
  ],
  "test_integration": {
    "coverage_status": "partial",
    "auto_generated": true,
    "test_points": [

    ]
  },
  "analysis": {
    "component_count": 4,
    "net_count": 10
  }
}
