{
  "schema_version": "1.1",
  "identity": {
    "board_pn": "08D-05",
    "board_rev": "A1-01",
    "board_type": "schematic"
  },
  "metadata": {
    "project_name": "PHOTODIODE AMPLIFIER",
    "revision": "A1-01",
    "source_tool": "EAGLE 6.3"
  },
  "components": [
    {
      "refdes": "C1",
      "value": "",
      "footprint": "C050-024X044",
      "pins": [
        {
          "pin_number": "2",
          "net": "OUT_INVERTING"
        },
        {
          "pin_number": "1",
          "net": "SENSOR_SIGNAL"
        }
      ]
    },
    {
      "refdes": "C2",
      "value": "",
      "footprint": "C050-024X044",
      "pins": [
        {
          "pin_number": "1",
          "net": "FEEDBACK"
        },
        {
          "pin_number": "2",
          "net": "OUTPUT_NON_INVERTING"
        }
      ]
    },
    {
      "refdes": "C3",
      "value": "",
      "footprint": "C5MM",
      "pins": [
        {
          "pin_number": "2",
          "net": "GND"
        },
        {
          "pin_number": "1",
          "net": "V+"
        }
      ]
    },
    {
      "refdes": "C4",
      "value": "",
      "footprint": "C050-024X044",
      "pins": [
        {
          "pin_number": "2",
          "net": "GND"
        },
        {
          "pin_number": "1",
          "net": "V+"
        }
      ]
    },
    {
      "refdes": "C5",
      "value": "",
      "footprint": "C5MM",
      "pins": [
        {
          "pin_number": "1",
          "net": "GND"
        },
        {
          "pin_number": "2",
          "net": "V-"
        }
      ]
    },
    {
      "refdes": "C6",
      "value": "",
      "footprint": "C050-024X044",
      "pins": [
        {
          "pin_number": "1",
          "net": "GND"
        },
        {
          "pin_number": "2",
          "net": "V-"
        }
      ]
    },
    {
      "refdes": "D1",
      "value": "",
      "footprint": "LED5MM",
      "pins": [
        {
          "pin_number": "1",
          "net": "GND"
        },
        {
          "pin_number": "1",
          "net": "SENSOR_SIGNAL"
        }
      ]
    },
    {
      "refdes": "P1",
      "value": "",
      "footprint": "PINS_1X5",
      "pins": [
        {
          "pin_number": "1",
          "net": "GND"
        },
        {
          "pin_number": "4",
          "net": "OUTPUT_NON_INVERTING"
        },
        {
          "pin_number": "5",
          "net": "OUT_INVERTING"
        },
        {
          "pin_number": "2",
          "net": "V+"
        },
        {
          "pin_number": "3",
          "net": "V-"
        }
      ]
    },
    {
      "refdes": "R1",
      "value": "",
      "footprint": "0204/10",
      "pins": [
        {
          "pin_number": "2",
          "net": "OUT_INVERTING"
        },
        {
          "pin_number": "1",
          "net": "SENSOR_SIGNAL"
        }
      ]
    },
    {
      "refdes": "R2",
      "value": "",
      "footprint": "0204/10",
      "pins": [
        {
          "pin_number": "2",
          "net": "FEEDBACK"
        },
        {
          "pin_number": "1",
          "net": "OUT_INVERTING"
        }
      ]
    },
    {
      "refdes": "R3",
      "value": "",
      "footprint": "0204/10",
      "pins": [
        {
          "pin_number": "1",
          "net": "FEEDBACK"
        },
        {
          "pin_number": "2",
          "net": "OUTPUT_NON_INVERTING"
        }
      ]
    },
    {
      "refdes": "R4",
      "value": "",
      "footprint": "0204/10",
      "pins": [
        {
          "pin_number": "1",
          "net": "GND"
        },
        {
          "pin_number": "2",
          "net": "NON_INVERTING_INPUT_AMP_1"
        }
      ]
    },
    {
      "refdes": "R5",
      "value": "",
      "footprint": "0204/10",
      "pins": [
        {
          "pin_number": "1",
          "net": "GND"
        },
        {
          "pin_number": "2",
          "net": "NON_INVERTING_INPUT_AMP_2"
        }
      ]
    },
    {
      "refdes": "TP1",
      "value": "GND",
      "footprint": "PINS_1_TESTPOINT_KE5000_NOTEXT",
      "pins": [
        {
          "pin_number": "1",
          "net": "GND"
        }
      ]
    },
    {
      "refdes": "TP2",
      "value": "V+",
      "footprint": "PINS_1_TESTPOINT_KE5000_NOTEXT",
      "pins": [
        {
          "pin_number": "1",
          "net": "V+"
        }
      ]
    },
    {
      "refdes": "TP3",
      "value": "V-",
      "footprint": "PINS_1_TESTPOINT_KE5000_NOTEXT",
      "pins": [
        {
          "pin_number": "1",
          "net": "V-"
        }
      ]
    },
    {
      "refdes": "TP4",
      "value": "SENSOR_SIGNAL",
      "footprint": "PINS_1_TESTPOINT_KE5000_NOTEXT",
      "pins": [
        {
          "pin_number": "1",
          "net": "SENSOR_SIGNAL"
        }
      ]
    },
    {
      "refdes": "TP5",
      "value": "OUT_INVERTED",
      "footprint": "PINS_1_TESTPOINT_KE5000_NOTEXT",
      "pins": [
        {
          "pin_number": "1",
          "net": "OUT_INVERTING"
        }
      ]
    },
    {
      "refdes": "TP6",
      "value": "FEEDBACK_SIGNAL",
      "footprint": "PINS_1_TESTPOINT_KE5000_NOTEXT",
      "pins": [
        {
          "pin_number": "1",
          "net": "FEEDBACK"
        }
      ]
    },
    {
      "refdes": "TP7",
      "value": "OUTPUT_NON_INVERTED",
      "footprint": "PINS_1_TESTPOINT_KE5000_NOTEXT",
      "pins": [
        {
          "pin_number": "1",
          "net": "OUTPUT_NON_INVERTING"
        }
      ]
    },
    {
      "refdes": "U1",
      "value": "LF412",
      "footprint": "DIL08",
      "pins": [
        {
          "pin_number": "-IN",
          "net": "FEEDBACK"
        },
        {
          "pin_number": "+IN",
          "net": "NON_INVERTING_INPUT_AMP_1"
        },
        {
          "pin_number": "+IN",
          "net": "NON_INVERTING_INPUT_AMP_2"
        },
        {
          "pin_number": "OUT",
          "net": "OUTPUT_NON_INVERTING"
        },
        {
          "pin_number": "OUT",
          "net": "OUT_INVERTING"
        },
        {
          "pin_number": "-IN",
          "net": "SENSOR_SIGNAL"
        },
        {
          "pin_number": "V+",
          "net": "V+"
        },
        {
          "pin_number": "V-",
          "net": "V-"
        }
      ]
    }
  ],
  "nets": [
    {
      "name": "FEEDBACK",
      "connections": [
        { "refdes": "U1", "pin": "-IN" },
        { "refdes": "R2", "pin": "2" },
        { "refdes": "R3", "pin": "1" },
        { "refdes": "C2", "pin": "1" },
        { "refdes": "TP6", "pin": "1" }
      ]
    },
    {
      "name": "GND",
      "connections": [
        { "refdes": "C3", "pin": "2" },
        { "refdes": "C4", "pin": "2" },
        { "refdes": "P1", "pin": "1" },
        { "refdes": "TP1", "pin": "1" },
        { "refdes": "C5", "pin": "1" },
        { "refdes": "C6", "pin": "1" },
        { "refdes": "R4", "pin": "1" },
        { "refdes": "R5", "pin": "1" },
        { "refdes": "D1", "pin": "1" }
      ]
    },
    {
      "name": "NON_INVERTING_INPUT_AMP_1",
      "connections": [
        { "refdes": "U1", "pin": "+IN" },
        { "refdes": "R4", "pin": "2" }
      ]
    },
    {
      "name": "NON_INVERTING_INPUT_AMP_2",
      "connections": [
        { "refdes": "U1", "pin": "+IN" },
        { "refdes": "R5", "pin": "2" }
      ]
    },
    {
      "name": "OUTPUT_NON_INVERTING",
      "connections": [
        { "refdes": "U1", "pin": "OUT" },
        { "refdes": "R3", "pin": "2" },
        { "refdes": "C2", "pin": "2" },
        { "refdes": "P1", "pin": "4" },
        { "refdes": "TP7", "pin": "1" }
      ]
    },
    {
      "name": "OUT_INVERTING",
      "connections": [
        { "refdes": "U1", "pin": "OUT" },
        { "refdes": "R2", "pin": "1" },
        { "refdes": "R1", "pin": "2" },
        { "refdes": "C1", "pin": "2" },
        { "refdes": "P1", "pin": "5" },
        { "refdes": "TP5", "pin": "1" }
      ]
    },
    {
      "name": "SENSOR_SIGNAL",
      "connections": [
        { "refdes": "U1", "pin": "-IN" },
        { "refdes": "R1", "pin": "1" },
        { "refdes": "C1", "pin": "1" },
        { "refdes": "TP4", "pin": "1" },
        { "refdes": "D1", "pin": "1" }
      ]
    },
    {
      "name": "V+",
      "connections": [
        { "refdes": "P1", "pin": "2" },
        { "refdes": "TP2", "pin": "1" },
        { "refdes": "C3", "pin": "1" },
        { "refdes": "C4", "pin": "1" },
        { "refdes": "U1", "pin": "V+" }
      ]
    },
    {
      "name": "V-",
      "connections": [
        { "refdes": "P1", "pin": "3" },
        { "refdes": "TP3", "pin": "1" },
        { "refdes": "C5", "pin": "2" },
        { "refdes": "C6", "pin": "2" },
        { "refdes": "U1", "pin": "V-" }
      ]
    }
  ],
  "test_integration": {
    "coverage_status": "partial",
    "auto_generated": true,
    "test_points": [
      {
        "refdes": "TP1",
        "net": "GND",
        "measurement_type": "voltage"
      },
      {
        "refdes": "TP2",
        "net": "V+",
        "measurement_type": "voltage"
      },
      {
        "refdes": "TP3",
        "net": "V-",
        "measurement_type": "voltage"
      },
      {
        "refdes": "TP4",
        "net": "SENSOR_SIGNAL",
        "measurement_type": "voltage"
      },
      {
        "refdes": "TP5",
        "net": "OUT_INVERTING",
        "measurement_type": "voltage"
      },
      {
        "refdes": "TP6",
        "net": "FEEDBACK",
        "measurement_type": "voltage"
      },
      {
        "refdes": "TP7",
        "net": "OUTPUT_NON_INVERTING",
        "measurement_type": "voltage"
      }
    ]
  },
  "analysis": {
    "component_count": 21,
    "net_count": 9
  }
}
