{
  "schema_version": "1.1",
  "identity": {
    "board_pn": "04B-010",
    "board_rev": "A1-01",
    "board_type": "schematic"
  },
  "metadata": {
    "project_name": "EMITTER FOLLOWER AMPLIFIER",
    "revision": "A1-01",
    "source_tool": "EAGLE 6.3"
  },
  "components": [
    {
      "refdes": "C1",
      "value": "100n",
      "footprint": "C050-024X044",
      "pins": [
        {
          "pin_number": "2",
          "net": "BASE"
        },
        {
          "pin_number": "1",
          "net": "INPUT"
        }
      ]
    },
    {
      "refdes": "C2",
      "value": "100n",
      "footprint": "C050-024X044",
      "pins": [
        {
          "pin_number": "2",
          "net": "GND"
        },
        {
          "pin_number": "1",
          "net": "V+"
        }
      ]
    },
    {
      "refdes": "C3",
      "value": "100n",
      "footprint": "C050-024X044",
      "pins": [
        {
          "pin_number": "2",
          "net": "GND"
        },
        {
          "pin_number": "1",
          "net": "V+"
        }
      ]
    },
    {
      "refdes": "C4",
      "value": "100n",
      "footprint": "C050-024X044",
      "pins": [
        {
          "pin_number": "1",
          "net": "EMITTER"
        },
        {
          "pin_number": "2",
          "net": "OUTPUT"
        }
      ]
    },
    {
      "refdes": "P1",
      "value": "",
      "footprint": "PINS_1X5",
      "pins": [
        {
          "pin_number": "1",
          "net": "GND"
        },
        {
          "pin_number": "4",
          "net": "INPUT"
        },
        {
          "pin_number": "5",
          "net": "OUTPUT"
        },
        {
          "pin_number": "2",
          "net": "V+"
        }
      ]
    },
    {
      "refdes": "Q1",
      "value": "NPN",
      "footprint": "TO92-EBC-OVAL",
      "pins": [
        {
          "pin_number": "B",
          "net": "BASE"
        },
        {
          "pin_number": "E",
          "net": "EMITTER"
        },
        {
          "pin_number": "C",
          "net": "V+"
        }
      ]
    },
    {
      "refdes": "R1",
      "value": "1k",
      "footprint": "0207/10",
      "pins": [
        {
          "pin_number": "1",
          "net": "BASE_BIAS_1"
        },
        {
          "pin_number": "2",
          "net": "V+"
        }
      ]
    },
    {
      "refdes": "R2",
      "value": "100k",
      "footprint": "TRIM_0100",
      "pins": [
        {
          "pin_number": "2",
          "net": "BASE"
        },
        {
          "pin_number": "3",
          "net": "BASE_BIAS_1"
        },
        {
          "pin_number": "1",
          "net": "BASE_BIAS_2"
        }
      ]
    },
    {
      "refdes": "R3",
      "value": "1k",
      "footprint": "0207/10",
      "pins": [
        {
          "pin_number": "2",
          "net": "BASE_BIAS_2"
        },
        {
          "pin_number": "1",
          "net": "GND"
        }
      ]
    },
    {
      "refdes": "R4",
      "value": "2k",
      "footprint": "0207/10",
      "pins": [
        {
          "pin_number": "2",
          "net": "EMITTER"
        },
        {
          "pin_number": "1",
          "net": "GND"
        }
      ]
    },
    {
      "refdes": "R5",
      "value": "10k",
      "footprint": "0207/10",
      "pins": [
        {
          "pin_number": "1",
          "net": "GND"
        },
        {
          "pin_number": "2",
          "net": "OUTPUT"
        }
      ]
    },
    {
      "refdes": "TP1",
      "value": "INPUT",
      "footprint": "PINS_1_TESTPOINT_KE5000_NOTEXT",
      "pins": [
        {
          "pin_number": "1",
          "net": "INPUT"
        }
      ]
    },
    {
      "refdes": "TP2",
      "value": "BASE_BIAS_1",
      "footprint": "PINS_1_TESTPOINT_KE5000_NOTEXT",
      "pins": [
        {
          "pin_number": "1",
          "net": "BASE_BIAS_1"
        }
      ]
    },
    {
      "refdes": "TP3",
      "value": "BASE_BIAS_2",
      "footprint": "PINS_1_TESTPOINT_KE5000_NOTEXT",
      "pins": [
        {
          "pin_number": "1",
          "net": "BASE_BIAS_2"
        }
      ]
    },
    {
      "refdes": "TP4",
      "value": "BASE",
      "footprint": "PINS_1_TESTPOINT_KE5000_NOTEXT",
      "pins": [
        {
          "pin_number": "1",
          "net": "BASE"
        }
      ]
    },
    {
      "refdes": "TP5",
      "value": "V+",
      "footprint": "PINS_1_TESTPOINT_KE5000_NOTEXT",
      "pins": [
        {
          "pin_number": "1",
          "net": "V+"
        }
      ]
    },
    {
      "refdes": "TP6",
      "value": "GND",
      "footprint": "PINS_1_TESTPOINT_KE5000_NOTEXT",
      "pins": [
        {
          "pin_number": "1",
          "net": "GND"
        }
      ]
    },
    {
      "refdes": "TP7",
      "value": "EMITTER",
      "footprint": "PINS_1_TESTPOINT_KE5000_NOTEXT",
      "pins": [
        {
          "pin_number": "1",
          "net": "EMITTER"
        }
      ]
    },
    {
      "refdes": "TP8",
      "value": "OUTPUT",
      "footprint": "PINS_1_TESTPOINT_KE5000_NOTEXT",
      "pins": [
        {
          "pin_number": "1",
          "net": "OUTPUT"
        }
      ]
    }
  ],
  "nets": [
    {
      "name": "BASE",
      "connections": [
        { "refdes": "R2", "pin": "2" },
        { "refdes": "Q1", "pin": "B" },
        { "refdes": "TP4", "pin": "1" },
        { "refdes": "C1", "pin": "2" }
      ]
    },
    {
      "name": "BASE_BIAS_1",
      "connections": [
        { "refdes": "R1", "pin": "1" },
        { "refdes": "TP2", "pin": "1" },
        { "refdes": "R2", "pin": "3" }
      ]
    },
    {
      "name": "BASE_BIAS_2",
      "connections": [
        { "refdes": "R2", "pin": "1" },
        { "refdes": "TP3", "pin": "1" },
        { "refdes": "R3", "pin": "2" }
      ]
    },
    {
      "name": "EMITTER",
      "connections": [
        { "refdes": "TP7", "pin": "1" },
        { "refdes": "C4", "pin": "1" },
        { "refdes": "R4", "pin": "2" },
        { "refdes": "Q1", "pin": "E" }
      ]
    },
    {
      "name": "GND",
      "connections": [
        { "refdes": "C2", "pin": "2" },
        { "refdes": "C3", "pin": "2" },
        { "refdes": "R3", "pin": "1" },
        { "refdes": "TP6", "pin": "1" },
        { "refdes": "P1", "pin": "1" },
        { "refdes": "R5", "pin": "1" },
        { "refdes": "R4", "pin": "1" }
      ]
    },
    {
      "name": "INPUT",
      "connections": [
        { "refdes": "TP1", "pin": "1" },
        { "refdes": "C1", "pin": "1" },
        { "refdes": "P1", "pin": "4" }
      ]
    },
    {
      "name": "OUTPUT",
      "connections": [
        { "refdes": "P1", "pin": "5" },
        { "refdes": "C4", "pin": "2" },
        { "refdes": "R5", "pin": "2" },
        { "refdes": "TP8", "pin": "1" }
      ]
    },
    {
      "name": "V+",
      "connections": [
        { "refdes": "TP5", "pin": "1" },
        { "refdes": "R1", "pin": "2" },
        { "refdes": "P1", "pin": "2" },
        { "refdes": "C2", "pin": "1" },
        { "refdes": "C3", "pin": "1" },
        { "refdes": "Q1", "pin": "C" }
      ]
    }
  ],
  "test_integration": {
    "coverage_status": "partial",
    "auto_generated": true,
    "test_points": [
      {
        "refdes": "TP1",
        "net": "INPUT",
        "measurement_type": "voltage"
      },
      {
        "refdes": "TP2",
        "net": "BASE_BIAS_1",
        "measurement_type": "voltage"
      },
      {
        "refdes": "TP3",
        "net": "BASE_BIAS_2",
        "measurement_type": "voltage"
      },
      {
        "refdes": "TP4",
        "net": "BASE",
        "measurement_type": "voltage"
      },
      {
        "refdes": "TP5",
        "net": "V+",
        "measurement_type": "voltage"
      },
      {
        "refdes": "TP6",
        "net": "GND",
        "measurement_type": "voltage"
      },
      {
        "refdes": "TP7",
        "net": "EMITTER",
        "measurement_type": "voltage"
      },
      {
        "refdes": "TP8",
        "net": "OUTPUT",
        "measurement_type": "voltage"
      }
    ]
  },
  "analysis": {
    "component_count": 19,
    "net_count": 8
  }
}
