{
  "schema_version": "1.1",
  "identity": {
    "board_pn": "02A-07",
    "board_rev": "A1-01",
    "board_type": "schematic"
  },
  "metadata": {
    "project_name": "REDUNDANT SWITCH INPUT CIRCUIT",
    "revision": "A1-01",
    "source_tool": "EAGLE 6.3"
  },
  "components": [
    {
      "refdes": "C1",
      "value": "100n",
      "footprint": "C050-024X044",
      "pins": [
        {
          "pin_number": "2",
          "net": "GND"
        },
        {
          "pin_number": "1",
          "net": "INPUT_N_SIDE_BASE_GATE"
        }
      ]
    },
    {
      "refdes": "C2",
      "value": "100n",
      "footprint": "C050-024X044",
      "pins": [
        {
          "pin_number": "2",
          "net": "INPUT_P_SIDE_BASE_GATE"
        },
        {
          "pin_number": "1",
          "net": "V+"
        }
      ]
    },
    {
      "refdes": "P1",
      "value": "2.0mm, RA, PIN HEADER",
      "footprint": "PINS_1X7",
      "pins": [
        {
          "pin_number": "1",
          "net": "GND"
        },
        {
          "pin_number": "5",
          "net": "INPUT_N_SIDE"
        },
        {
          "pin_number": "4",
          "net": "INPUT_P_SIDE"
        },
        {
          "pin_number": "7",
          "net": "OUTPUT_N_SIDE_COLLECTOR_DRAIN"
        },
        {
          "pin_number": "6",
          "net": "OUTPUT_P_SIDE_COLLECTOR_DRAIN"
        },
        {
          "pin_number": "2",
          "net": "V+"
        }
      ]
    },
    {
      "refdes": "Q1",
      "value": "2N3904",
      "footprint": "TO92-EBC-OVAL",
      "pins": [
        {
          "pin_number": "E",
          "net": "GND"
        },
        {
          "pin_number": "B",
          "net": "INPUT_N_SIDE_BASE_GATE"
        },
        {
          "pin_number": "C",
          "net": "OUTPUT_N_SIDE_COLLECTOR_DRAIN"
        }
      ]
    },
    {
      "refdes": "Q2",
      "value": "2N3906",
      "footprint": "TO92-EBC-OVAL",
      "pins": [
        {
          "pin_number": "B",
          "net": "INPUT_P_SIDE_BASE_GATE"
        },
        {
          "pin_number": "C",
          "net": "OUTPUT_P_SIDE_COLLECTOR_DRAIN"
        },
        {
          "pin_number": "E",
          "net": "V+"
        }
      ]
    },
    {
      "refdes": "R1",
      "value": "10k",
      "footprint": "0204/10",
      "pins": [
        {
          "pin_number": "2",
          "net": "INPUT_N_SIDE"
        },
        {
          "pin_number": "1",
          "net": "INPUT_N_SIDE_BASE_GATE"
        }
      ]
    },
    {
      "refdes": "R2",
      "value": "10k",
      "footprint": "0204/10",
      "pins": [
        {
          "pin_number": "2",
          "net": "GND"
        },
        {
          "pin_number": "1",
          "net": "INPUT_N_SIDE_BASE_GATE"
        }
      ]
    },
    {
      "refdes": "R3",
      "value": "4k7",
      "footprint": "0204/10",
      "pins": [
        {
          "pin_number": "1",
          "net": "OUTPUT_N_SIDE_COLLECTOR_DRAIN"
        },
        {
          "pin_number": "2",
          "net": "V+"
        }
      ]
    },
    {
      "refdes": "R4",
      "value": "10k",
      "footprint": "0204/10",
      "pins": [
        {
          "pin_number": "2",
          "net": "INPUT_P_SIDE"
        },
        {
          "pin_number": "1",
          "net": "INPUT_P_SIDE_BASE_GATE"
        }
      ]
    },
    {
      "refdes": "R5",
      "value": "10k",
      "footprint": "0204/10",
      "pins": [
        {
          "pin_number": "1",
          "net": "INPUT_P_SIDE_BASE_GATE"
        },
        {
          "pin_number": "2",
          "net": "V+"
        }
      ]
    },
    {
      "refdes": "R6",
      "value": "4k7",
      "footprint": "0204/10",
      "pins": [
        {
          "pin_number": "2",
          "net": "GND"
        },
        {
          "pin_number": "1",
          "net": "OUTPUT_P_SIDE_COLLECTOR_DRAIN"
        }
      ]
    },
    {
      "refdes": "SW1",
      "value": "",
      "footprint": "6X6MM",
      "pins": [
        {
          "pin_number": "1",
          "net": "INPUT_N_SIDE"
        },
        {
          "pin_number": "2",
          "net": "INPUT_P_SIDE"
        }
      ]
    },
    {
      "refdes": "TP1",
      "value": "IN_P_SIDE",
      "footprint": "PINS_1_TESTPOINT_KE5000_NOTEXT",
      "pins": [
        {
          "pin_number": "1",
          "net": "INPUT_P_SIDE"
        }
      ]
    },
    {
      "refdes": "TP2",
      "value": "IN_N_SIDE",
      "footprint": "PINS_1_TESTPOINT_KE5000_NOTEXT",
      "pins": [
        {
          "pin_number": "1",
          "net": "INPUT_N_SIDE"
        }
      ]
    },
    {
      "refdes": "TP3",
      "value": "INPUT_P_SIDE_BASE_GATE",
      "footprint": "PINS_1_TESTPOINT_KE5000_NOTEXT",
      "pins": [
        {
          "pin_number": "1",
          "net": "INPUT_P_SIDE_BASE_GATE"
        }
      ]
    },
    {
      "refdes": "TP4",
      "value": "INPUT_N_SIDE_BASE_GATE",
      "footprint": "PINS_1_TESTPOINT_KE5000_NOTEXT",
      "pins": [
        {
          "pin_number": "1",
          "net": "INPUT_N_SIDE_BASE_GATE"
        }
      ]
    },
    {
      "refdes": "TP5",
      "value": "OUTPUT_P_SIDE_COLLECTOR_DRAIN",
      "footprint": "PINS_1_TESTPOINT_KE5000_NOTEXT",
      "pins": [
        {
          "pin_number": "1",
          "net": "OUTPUT_P_SIDE_COLLECTOR_DRAIN"
        }
      ]
    },
    {
      "refdes": "TP6",
      "value": "OUTPUT_N_SIDE_COLLECTOR_DRAIN",
      "footprint": "PINS_1_TESTPOINT_KE5000_NOTEXT",
      "pins": [
        {
          "pin_number": "1",
          "net": "OUTPUT_N_SIDE_COLLECTOR_DRAIN"
        }
      ]
    },
    {
      "refdes": "TP7",
      "value": "V+",
      "footprint": "PINS_1_TESTPOINT_KE5000_NOTEXT",
      "pins": [
        {
          "pin_number": "1",
          "net": "V+"
        }
      ]
    },
    {
      "refdes": "TP8",
      "value": "GND",
      "footprint": "PINS_1_TESTPOINT_KE5000_NOTEXT",
      "pins": [
        {
          "pin_number": "1",
          "net": "GND"
        }
      ]
    }
  ],
  "nets": [
    {
      "name": "GND",
      "connections": [
        { "refdes": "Q1", "pin": "E" },
        { "refdes": "R2", "pin": "2" },
        { "refdes": "R6", "pin": "2" },
        { "refdes": "C1", "pin": "2" },
        { "refdes": "TP8", "pin": "1" },
        { "refdes": "P1", "pin": "1" }
      ]
    },
    {
      "name": "INPUT_N_SIDE",
      "connections": [
        { "refdes": "SW1", "pin": "1" },
        { "refdes": "R1", "pin": "2" },
        { "refdes": "TP2", "pin": "1" },
        { "refdes": "P1", "pin": "5" }
      ]
    },
    {
      "name": "INPUT_N_SIDE_BASE_GATE",
      "connections": [
        { "refdes": "R1", "pin": "1" },
        { "refdes": "R2", "pin": "1" },
        { "refdes": "C1", "pin": "1" },
        { "refdes": "Q1", "pin": "B" },
        { "refdes": "TP4", "pin": "1" }
      ]
    },
    {
      "name": "INPUT_P_SIDE",
      "connections": [
        { "refdes": "R4", "pin": "2" },
        { "refdes": "SW1", "pin": "2" },
        { "refdes": "TP1", "pin": "1" },
        { "refdes": "P1", "pin": "4" }
      ]
    },
    {
      "name": "INPUT_P_SIDE_BASE_GATE",
      "connections": [
        { "refdes": "R5", "pin": "1" },
        { "refdes": "R4", "pin": "1" },
        { "refdes": "C2", "pin": "2" },
        { "refdes": "Q2", "pin": "B" },
        { "refdes": "TP3", "pin": "1" }
      ]
    },
    {
      "name": "OUTPUT_N_SIDE_COLLECTOR_DRAIN",
      "connections": [
        { "refdes": "R3", "pin": "1" },
        { "refdes": "Q1", "pin": "C" },
        { "refdes": "TP6", "pin": "1" },
        { "refdes": "P1", "pin": "7" }
      ]
    },
    {
      "name": "OUTPUT_P_SIDE_COLLECTOR_DRAIN",
      "connections": [
        { "refdes": "R6", "pin": "1" },
        { "refdes": "Q2", "pin": "C" },
        { "refdes": "TP5", "pin": "1" },
        { "refdes": "P1", "pin": "6" }
      ]
    },
    {
      "name": "V+",
      "connections": [
        { "refdes": "R5", "pin": "2" },
        { "refdes": "Q2", "pin": "E" },
        { "refdes": "C2", "pin": "1" },
        { "refdes": "R3", "pin": "2" },
        { "refdes": "TP7", "pin": "1" },
        { "refdes": "P1", "pin": "2" }
      ]
    }
  ],
  "test_integration": {
    "coverage_status": "partial",
    "auto_generated": true,
    "test_points": [
      {
        "refdes": "TP1",
        "net": "INPUT_P_SIDE",
        "measurement_type": "voltage"
      },
      {
        "refdes": "TP2",
        "net": "INPUT_N_SIDE",
        "measurement_type": "voltage"
      },
      {
        "refdes": "TP3",
        "net": "INPUT_P_SIDE_BASE_GATE",
        "measurement_type": "voltage"
      },
      {
        "refdes": "TP4",
        "net": "INPUT_N_SIDE_BASE_GATE",
        "measurement_type": "voltage"
      },
      {
        "refdes": "TP5",
        "net": "OUTPUT_P_SIDE_COLLECTOR_DRAIN",
        "measurement_type": "voltage"
      },
      {
        "refdes": "TP6",
        "net": "OUTPUT_N_SIDE_COLLECTOR_DRAIN",
        "measurement_type": "voltage"
      },
      {
        "refdes": "TP7",
        "net": "V+",
        "measurement_type": "voltage"
      },
      {
        "refdes": "TP8",
        "net": "GND",
        "measurement_type": "voltage"
      }
    ]
  },
  "analysis": {
    "component_count": 20,
    "net_count": 8
  }
}
